{
  "quantum_computing": {
    "query": "Latest developments in quantum computing 2024",
    "sources": {
      "web": [
        {
          "title": "Quantum Computing Breakthrough 2024",
          "url": "https://example.com/quantum-2024",
          "snippet": "Recent advances in quantum computing..."
        }
      ],
      "papers": [
        {
          "title": "Quantum Error Correction Advances",
          "authors": "Smith, J. et al.",
          "summary": "This paper presents new methods...",
          "url": "https://arxiv.org/abs/2024.12345"
        }
      ],
      "news": [
        {
          "title": "Quantum Computing Milestone Reached",
          "url": "https://example.com/news/quantum",
          "snippet": "Scientists achieve new quantum computing milestone..."
        }
      ]
    },
    "analysis": {
      "summary": [
        "Significant progress in quantum error correction",
        "New quantum algorithms showing promise",
        "Industry investment increasing"
      ],
      "contradictions": [],
      "credibility": [
        "Research papers: High - Peer-reviewed sources",
        "News sources: Medium - Recent but need verification"
      ],
      "key_claims": [
        "Quantum computing advancing rapidly",
        "Error correction is key challenge",
        "Commercial applications emerging"
      ]
    },
    "insights": {
      "insights": [
        "Quantum computing is reaching practical milestones",
        "Error correction remains critical challenge",
        "Industry investment accelerating"
      ],
      "hypotheses": [
        "Hypothesis 1: Practical quantum advantage within 5 years",
        "Hypothesis 2: Error correction will be solved through hybrid approaches"
      ],
      "trends": [
        "Trend 1: Increasing collaboration between academia and industry",
        "Trend 2: Focus on error correction and noise reduction"
      ],
      "reasoning_chains": [
        "If error correction improves, then practical applications will emerge because noise is the main barrier",
        "If industry investment continues, then commercialization will accelerate because resources enable progress"
      ]
    },
    "report": "# Research Report: Latest developments in quantum computing 2024\n\n## Executive Summary\n\nThis report synthesizes findings from multiple sources including web articles, research papers, and news sources. The analysis identifies key trends, contradictions, and insights relevant to quantum computing developments in 2024.\n\n## Key Findings\n\n- Significant progress in quantum error correction\n- New quantum algorithms showing promise\n- Industry investment increasing\n\n## Source Analysis\n\n### Credibility Assessment\n\n- Research papers: High - Peer-reviewed sources\n- News sources: Medium - Recent but need verification\n\n## Contradictions & Validation\n\nNo significant contradictions identified across sources.\n\n## Insights & Recommendations\n\n### Key Insights\n\n- Quantum computing is reaching practical milestones\n- Error correction remains critical challenge\n- Industry investment accelerating\n\n### Hypotheses\n\n- Hypothesis 1: Practical quantum advantage within 5 years\n- Hypothesis 2: Error correction will be solved through hybrid approaches\n\n### Trends\n\n- Trend 1: Increasing collaboration between academia and industry\n- Trend 2: Focus on error correction and noise reduction\n\n## Sources Cited\n\n1. Quantum Computing Breakthrough 2024\n   https://example.com/quantum-2024\n\n2. Quantum Error Correction Advances\n   https://arxiv.org/abs/2024.12345\n\n3. Quantum Computing Milestone Reached\n   https://example.com/news/quantum\n",
    "error": ""
  }
}

